Enter password: ****
Welcome to the MySQL monitor.  Commands end with ; or \g.
Your MySQL connection id is 20
Server version: 8.0.33 MySQL Community Server - GPL

Copyright (c) 2000, 2023, Oracle and/or its affiliates.

Oracle is a registered trademark of Oracle Corporation and/or its
affiliates. Other names may be trademarks of their respective
owners.

Type 'help;' or '\h' for help. Type '\c' to clear the current input statement.

mysql> show databases;
+--------------------+
| Database           |
+--------------------+
| information_schema |
| mysql              |
| performance_schema |
| sakila             |
| sys                |
| world              |
+--------------------+
6 rows in set (0.01 sec)

mysql> create database WD2;
Query OK, 1 row affected (0.01 sec)

mysql> show databases;
+--------------------+
| Database           |
+--------------------+
| information_schema |
| mysql              |
| performance_schema |
| sakila             |
| sys                |
| wd2                |
| world              |
+--------------------+
7 rows in set (0.00 sec)

mysql> use wd2;
Database changed
mysql> create table collage(s_n int,name varchar(100),bill float);
Query OK, 0 rows affected (0.02 sec)

mysql> desc collage;
+-------+--------------+------+-----+---------+-------+
| Field | Type         | Null | Key | Default | Extra |
+-------+--------------+------+-----+---------+-------+
| s_n   | int          | YES  |     | NULL    |       |
| name  | varchar(100) | YES  |     | NULL    |       |
| bill  | float        | YES  |     | NULL    |       |
+-------+--------------+------+-----+---------+-------+
3 rows in set (0.00 sec)

mysql> insert into collage values(1,"krishna",12.32);
Query OK, 1 row affected (0.01 sec)

mysql> select * from collage;
+------+---------+-------+
| s_n  | name    | bill  |
+------+---------+-------+
|    1 | krishna | 12.32 |
+------+---------+-------+
1 row in set (0.00 sec)

mysql> insert into collage values(2,"Rohan",34.34),(3,"Sohan",45.231);
Query OK, 2 rows affected (0.01 sec)
Records: 2  Duplicates: 0  Warnings: 0

mysql> select * from collage;
+------+---------+--------+
| s_n  | name    | bill   |
+------+---------+--------+
|    1 | krishna |  12.32 |
|    2 | Rohan   |  34.34 |
|    3 | Sohan   | 45.231 |
+------+---------+--------+
3 rows in set (0.00 sec)

mysql> select s_n,bill from collage;
+------+--------+
| s_n  | bill   |
+------+--------+
|    1 |  12.32 |
|    2 |  34.34 |
|    3 | 45.231 |
+------+--------+
3 rows in set (0.00 sec)

mysql> select bill,name,s_n from collage;
+--------+---------+------+
| bill   | name    | s_n  |
+--------+---------+------+
|  12.32 | krishna |    1 |
|  34.34 | Rohan   |    2 |
| 45.231 | Sohan   |    3 |
+--------+---------+------+
3 rows in set (0.00 sec)

mysql> select * from collage;
+------+---------+--------+
| s_n  | name    | bill   |
+------+---------+--------+
|    1 | krishna |  12.32 |
|    2 | Rohan   |  34.34 |
|    3 | Sohan   | 45.231 |
+------+---------+--------+
3 rows in set (0.00 sec)

mysql> insert into collage(s_n) values(4);
Query OK, 1 row affected (0.01 sec)

mysql> select * from collage;
+------+---------+--------+
| s_n  | name    | bill   |
+------+---------+--------+
|    1 | krishna |  12.32 |
|    2 | Rohan   |  34.34 |
|    3 | Sohan   | 45.231 |
|    4 | NULL    |   NULL |
+------+---------+--------+
4 rows in set (0.00 sec)

mysql> insert into collage(s_n) values(5),(6),(7);
Query OK, 3 rows affected (0.01 sec)
Records: 3  Duplicates: 0  Warnings: 0

mysql> select * from collage;
+------+---------+--------+
| s_n  | name    | bill   |
+------+---------+--------+
|    1 | krishna |  12.32 |
|    2 | Rohan   |  34.34 |
|    3 | Sohan   | 45.231 |
|    4 | NULL    |   NULL |
|    5 | NULL    |   NULL |
|    6 | NULL    |   NULL |
|    7 | NULL    |   NULL |
+------+---------+--------+
7 rows in set (0.00 sec)

mysql> --update
    -> ;
ERROR 1064 (42000): You have an error in your SQL syntax; check the manual that corresponds to your MySQL server version for the right syntax to use near '--update' at line 1
mysql> -- update
mysql> update table collage set name="krishna" where s_n=4;
ERROR 1064 (42000): You have an error in your SQL syntax; check the manual that corresponds to your MySQL server version for the right syntax to use near 'table collage set name="krishna" where s_n=4' at line 1
mysql> update collage set name="krishna" where s_n=4;
Query OK, 1 row affected (0.01 sec)
Rows matched: 1  Changed: 1  Warnings: 0

mysql> select * from collage;
+------+---------+--------+
| s_n  | name    | bill   |
+------+---------+--------+
|    1 | krishna |  12.32 |
|    2 | Rohan   |  34.34 |
|    3 | Sohan   | 45.231 |
|    4 | krishna |   NULL |
|    5 | NULL    |   NULL |
|    6 | NULL    |   NULL |
|    7 | NULL    |   NULL |
+------+---------+--------+
7 rows in set (0.00 sec)

mysql> update collage set bill=12.32 where s_n=4;
Query OK, 1 row affected (0.01 sec)
Rows matched: 1  Changed: 1  Warnings: 0

mysql> select * from collage;
+------+---------+--------+
| s_n  | name    | bill   |
+------+---------+--------+
|    1 | krishna |  12.32 |
|    2 | Rohan   |  34.34 |
|    3 | Sohan   | 45.231 |
|    4 | krishna |  12.32 |
|    5 | NULL    |   NULL |
|    6 | NULL    |   NULL |
|    7 | NULL    |   NULL |
+------+---------+--------+
7 rows in set (0.00 sec)

mysql> update collage set bill=13.32 where s_n=4;
Query OK, 1 row affected (0.01 sec)
Rows matched: 1  Changed: 1  Warnings: 0

mysql> select * from collage;
+------+---------+--------+
| s_n  | name    | bill   |
+------+---------+--------+
|    1 | krishna |  12.32 |
|    2 | Rohan   |  34.34 |
|    3 | Sohan   | 45.231 |
|    4 | krishna |  13.32 |
|    5 | NULL    |   NULL |
|    6 | NULL    |   NULL |
|    7 | NULL    |   NULL |
+------+---------+--------+
7 rows in set (0.00 sec)

mysql> update collage set name="Rohan",set bill =23.32 where s_n=5;
ERROR 1064 (42000): You have an error in your SQL syntax; check the manual that corresponds to your MySQL server version for the right syntax to use near 'set bill =23.32 where s_n=5' at line 1
mysql> update collage set name="Rohan", bill =23.32 where s_n=5;
Query OK, 1 row affected (0.01 sec)
Rows matched: 1  Changed: 1  Warnings: 0

mysql> select * from collage;
+------+---------+--------+
| s_n  | name    | bill   |
+------+---------+--------+
|    1 | krishna |  12.32 |
|    2 | Rohan   |  34.34 |
|    3 | Sohan   | 45.231 |
|    4 | krishna |  13.32 |
|    5 | Rohan   |  23.32 |
|    6 | NULL    |   NULL |
|    7 | NULL    |   NULL |
+------+---------+--------+
7 rows in set (0.00 sec)

mysql> update collage set name="Sohan", bill =24.32 where s_n=6;
Query OK, 1 row affected (0.00 sec)
Rows matched: 1  Changed: 1  Warnings: 0

mysql> update collage set name="Mohan", bill =24.32 where s_n=7;
Query OK, 1 row affected (0.00 sec)
Rows matched: 1  Changed: 1  Warnings: 0

mysql> select * from collage;
+------+---------+--------+
| s_n  | name    | bill   |
+------+---------+--------+
|    1 | krishna |  12.32 |
|    2 | Rohan   |  34.34 |
|    3 | Sohan   | 45.231 |
|    4 | krishna |  13.32 |
|    5 | Rohan   |  23.32 |
|    6 | Sohan   |  24.32 |
|    7 | Mohan   |  24.32 |
+------+---------+--------+
7 rows in set (0.00 sec)

mysql> -- where, and, or
mysql> select * from collage where bill>10 and bill<20;
+------+---------+-------+
| s_n  | name    | bill  |
+------+---------+-------+
|    1 | krishna | 12.32 |
|    4 | krishna | 13.32 |
+------+---------+-------+
2 rows in set (0.00 sec)

mysql> select * from collage where bill>=10 and bill<=20;
+------+---------+-------+
| s_n  | name    | bill  |
+------+---------+-------+
|    1 | krishna | 12.32 |
|    4 | krishna | 13.32 |
+------+---------+-------+
2 rows in set (0.00 sec)

mysql> select * from collage where bill>=10 or bill<=20;
+------+---------+--------+
| s_n  | name    | bill   |
+------+---------+--------+
|    1 | krishna |  12.32 |
|    2 | Rohan   |  34.34 |
|    3 | Sohan   | 45.231 |
|    4 | krishna |  13.32 |
|    5 | Rohan   |  23.32 |
|    6 | Sohan   |  24.32 |
|    7 | Mohan   |  24.32 |
+------+---------+--------+
7 rows in set (0.00 sec)

mysql> -- between
mysql> select * from collage;
+------+---------+--------+
| s_n  | name    | bill   |
+------+---------+--------+
|    1 | krishna |  12.32 |
|    2 | Rohan   |  34.34 |
|    3 | Sohan   | 45.231 |
|    4 | krishna |  13.32 |
|    5 | Rohan   |  23.32 |
|    6 | Sohan   |  24.32 |
|    7 | Mohan   |  24.32 |
+------+---------+--------+
7 rows in set (0.00 sec)

mysql> select * from collage where bill>=10 and bill<=20;
+------+---------+-------+
| s_n  | name    | bill  |
+------+---------+-------+
|    1 | krishna | 12.32 |
|    4 | krishna | 13.32 |
+------+---------+-------+
2 rows in set (0.00 sec)

mysql> select * from collage where bill between 10 and 20;
+------+---------+-------+
| s_n  | name    | bill  |
+------+---------+-------+
|    1 | krishna | 12.32 |
|    4 | krishna | 13.32 |
+------+---------+-------+
2 rows in set (0.00 sec)

mysql> select * from collage where bill between 12.32 and 20;
+------+---------+-------+
| s_n  | name    | bill  |
+------+---------+-------+
|    4 | krishna | 13.32 |
+------+---------+-------+
1 row in set (0.00 sec)

mysql> select * from collage where bill between 12.32 or 20;
ERROR 1064 (42000): You have an error in your SQL syntax; check the manual that corresponds to your MySQL server version for the right syntax to use near 'or 20' at line 1
mysql> select * from collage where bill between 12.32 and 20;
+------+---------+-------+
| s_n  | name    | bill  |
+------+---------+-------+
|    4 | krishna | 13.32 |
+------+---------+-------+
1 row in set (0.00 sec)

mysql> -- asc means ascending and desc descending
mysql> select * from collage;
+------+---------+--------+
| s_n  | name    | bill   |
+------+---------+--------+
|    1 | krishna |  12.32 |
|    2 | Rohan   |  34.34 |
|    3 | Sohan   | 45.231 |
|    4 | krishna |  13.32 |
|    5 | Rohan   |  23.32 |
|    6 | Sohan   |  24.32 |
|    7 | Mohan   |  24.32 |
+------+---------+--------+
7 rows in set (0.00 sec)

mysql> select * from collage order by bill asc;
+------+---------+--------+
| s_n  | name    | bill   |
+------+---------+--------+
|    1 | krishna |  12.32 |
|    4 | krishna |  13.32 |
|    5 | Rohan   |  23.32 |
|    6 | Sohan   |  24.32 |
|    7 | Mohan   |  24.32 |
|    2 | Rohan   |  34.34 |
|    3 | Sohan   | 45.231 |
+------+---------+--------+
7 rows in set (0.00 sec)

mysql> select * from collage order by bill;
+------+---------+--------+
| s_n  | name    | bill   |
+------+---------+--------+
|    1 | krishna |  12.32 |
|    4 | krishna |  13.32 |
|    5 | Rohan   |  23.32 |
|    6 | Sohan   |  24.32 |
|    7 | Mohan   |  24.32 |
|    2 | Rohan   |  34.34 |
|    3 | Sohan   | 45.231 |
+------+---------+--------+
7 rows in set (0.00 sec)

mysql> select * from collage order by desc;
ERROR 1064 (42000): You have an error in your SQL syntax; check the manual that corresponds to your MySQL server version for the right syntax to use near 'desc' at line 1
mysql> select * from collage order by name;
+------+---------+--------+
| s_n  | name    | bill   |
+------+---------+--------+
|    1 | krishna |  12.32 |
|    4 | krishna |  13.32 |
|    7 | Mohan   |  24.32 |
|    2 | Rohan   |  34.34 |
|    5 | Rohan   |  23.32 |
|    3 | Sohan   | 45.231 |
|    6 | Sohan   |  24.32 |
+------+---------+--------+
7 rows in set (0.00 sec)

mysql> select * from collage order by name,bill;
+------+---------+--------+
| s_n  | name    | bill   |
+------+---------+--------+
|    1 | krishna |  12.32 |
|    4 | krishna |  13.32 |
|    7 | Mohan   |  24.32 |
|    5 | Rohan   |  23.32 |
|    2 | Rohan   |  34.34 |
|    6 | Sohan   |  24.32 |
|    3 | Sohan   | 45.231 |
+------+---------+--------+
7 rows in set (0.00 sec)

mysql> -- limit
mysql> select * from collage order by desc limit 1;
ERROR 1064 (42000): You have an error in your SQL syntax; check the manual that corresponds to your MySQL server version for the right syntax to use near 'desc limit 1' at line 1
mysql> select * from collage order by desc limit(1);
ERROR 1064 (42000): You have an error in your SQL syntax; check the manual that corresponds to your MySQL server version for the right syntax to use near 'desc limit(1)' at line 1
mysql> select * from collage order by bill desc limit 1;
+------+-------+--------+
| s_n  | name  | bill   |
+------+-------+--------+
|    3 | Sohan | 45.231 |
+------+-------+--------+
1 row in set (0.00 sec)

mysql> select * from collage order by bill desc limit 2;
+------+-------+--------+
| s_n  | name  | bill   |
+------+-------+--------+
|    3 | Sohan | 45.231 |
|    2 | Rohan |  34.34 |
+------+-------+--------+
2 rows in set (0.00 sec)

mysql> select * from collage order by bill desc;
+------+---------+--------+
| s_n  | name    | bill   |
+------+---------+--------+
|    3 | Sohan   | 45.231 |
|    2 | Rohan   |  34.34 |
|    6 | Sohan   |  24.32 |
|    7 | Mohan   |  24.32 |
|    5 | Rohan   |  23.32 |
|    4 | krishna |  13.32 |
|    1 | krishna |  12.32 |
+------+---------+--------+
7 rows in set (0.00 sec)

mysql> select * from collage order by bill desc limit (2,1);
ERROR 1064 (42000): You have an error in your SQL syntax; check the manual that corresponds to your MySQL server version for the right syntax to use near '(2,1)' at line 1
mysql> select * from collage order by bill desc limit 2,1;
+------+-------+-------+
| s_n  | name  | bill  |
+------+-------+-------+
|    6 | Sohan | 24.32 |
+------+-------+-------+
1 row in set (0.00 sec)

mysql> select * from collage order by bill desc limit 1,1;
+------+-------+-------+
| s_n  | name  | bill  |
+------+-------+-------+
|    2 | Rohan | 34.34 |
+------+-------+-------+
1 row in set (0.00 sec)

mysql> select * from collage order by bill desc limit 1,2;
+------+-------+-------+
| s_n  | name  | bill  |
+------+-------+-------+
|    2 | Rohan | 34.34 |
|    6 | Sohan | 24.32 |
+------+-------+-------+
2 rows in set (0.00 sec)

mysql> -- aggregate function(count(),avg(),max(),min(),sum()distinct())
mysql> select * from collage;
+------+---------+--------+
| s_n  | name    | bill   |
+------+---------+--------+
|    1 | krishna |  12.32 |
|    2 | Rohan   |  34.34 |
|    3 | Sohan   | 45.231 |
|    4 | krishna |  13.32 |
|    5 | Rohan   |  23.32 |
|    6 | Sohan   |  24.32 |
|    7 | Mohan   |  24.32 |
+------+---------+--------+
7 rows in set (0.00 sec)

mysql> select count(s_n) from collage;
+------------+
| count(s_n) |
+------------+
|          7 |
+------------+
1 row in set (0.00 sec)

mysql> select min(bill) from collage;
+-----------+
| min(bill) |
+-----------+
|     12.32 |
+-----------+
1 row in set (0.00 sec)

mysql> update collage set bill =10000.00 where s_n=1;
Query OK, 1 row affected (0.01 sec)
Rows matched: 1  Changed: 1  Warnings: 0

mysql> select * from collage;
+------+---------+--------+
| s_n  | name    | bill   |
+------+---------+--------+
|    1 | krishna |  10000 |
|    2 | Rohan   |  34.34 |
|    3 | Sohan   | 45.231 |
|    4 | krishna |  13.32 |
|    5 | Rohan   |  23.32 |
|    6 | Sohan   |  24.32 |
|    7 | Mohan   |  24.32 |
+------+---------+--------+
7 rows in set (0.00 sec)

mysql> select min(bill) from collage;
+-----------+
| min(bill) |
+-----------+
|     13.32 |
+-----------+
1 row in set (0.00 sec)

mysql> select sum(bill) from collage;
+--------------------+
| sum(bill)          |
+--------------------+
| 10164.850997924805 |
+--------------------+
1 row in set (0.00 sec)

mysql> select distinct(bill) from collage;
+--------+
| bill   |
+--------+
|  10000 |
|  34.34 |
| 45.231 |
|  13.32 |
|  23.32 |
|  24.32 |
+--------+
6 rows in set (0.00 sec)

mysql>
